{
  "$schema": "http://json-schema.org/draft-07/schema#",
  "$id": "model_manifest.schema.json",
  "title": "Model Architecture Manifest",
  "description": "Statically-extracted ground truth about a model's learned architecture. Every fact carries a source_ref and confidence; unresolved values MUST be the string \"unknown\".",
  "type": "object",
  "required": ["schema_version", "model_name", "source_of_truth", "num_main_layers", "layer_groups", "prediction_modules", "facts"],
  "additionalProperties": false,
  "properties": {
    "schema_version": {"const": 1},
    "model_name": {"type": "string"},
    "adapter": {"type": ["string", "null"]},
    "adapter_selection": {
      "type": "object",
      "description": "How the family adapter was chosen. Recorded because selection strength is itself a fact about the manifest's reliability: a match on a config-key signature alone is weaker than a match on the family's own class names, and the reader cannot tell which happened from `adapter` alone.",
      "required": ["name", "confidence"],
      "additionalProperties": false,
      "properties": {
        "name": {"type": "string"},
        "confidence": {"$ref": "#/definitions/confidence"},
        "reasons": {"type": "array", "items": {"type": "string"}},
        "candidates": {
          "type": "array",
          "description": "Every adapter whose signature fired, including the losers. An ambiguous top tier is an error, never resolved silently, so this list documents that only one adapter reached it.",
          "items": {
            "type": "object",
            "required": ["adapter", "confidence"],
            "additionalProperties": false,
            "properties": {
              "adapter": {"type": "string"},
              "confidence": {"$ref": "#/definitions/confidence"}
            }
          }
        }
      }
    },
    "capabilities": {
      "type": "array",
      "description": "Family capabilities this source actually evidences. Validators gate family-specific rules on these (see check_dataflow D7), so a Dense model is never asked to have MoE branches. An absent capability means unknown-or-absent and asserts nothing.",
      "items": {"$ref": "#/definitions/capability"}
    },
    "dataflow_invariants": {
      "type": "array",
      "description": "Declarative dataflow constraints the family adapter asserts, evaluated by check_dataflow. Carried here rather than hardcoded in the checker: a checker holding its own family table cannot abstain for a family it has never seen. Only invariants whose gating capability is evidenced appear.",
      "items": {
        "type": "object",
        "required": ["id", "reason"],
        "additionalProperties": false,
        "properties": {
          "id": {"type": "string"},
          "requires": {
            "type": ["string", "null"],
            "description": "The capability id that gates this rule; null means ungated."
          },
          "kind": {
            "enum": ["parallel_join", "min_call_occurrences"],
            "description": "Generic checker operation; omitted defaults to parallel_join."
          },
          "match_any": {
            "type": "array",
            "items": {"type": "string"},
            "description": "Case-insensitive symbol fragments for min_call_occurrences."
          },
          "min_occurrences": {
            "type": "integer",
            "minimum": 1
          },
          "reason": {"type": "string", "description": "What goes wrong in the breakdown if the constraint is violated."}
        }
      }
    },
    "component_candidates": {
      "type": "array",
      "description": "Submodules each layer class declares in __init__, as CANDIDATES for the mapper. Not a decomposition: __init__ order is not execution order and a declared submodule may never be called, so containment and dataflow are decided against forward() (extract_dataflow.py).",
      "items": {
        "type": "object",
        "required": ["class_name", "source_ref", "components"],
        "additionalProperties": false,
        "properties": {
          "class_name": {"type": "string"},
          "source_ref": {"oneOf": [{"$ref": "#/definitions/source_ref"}, {"const": "unknown"}]},
          "components": {
            "type": "array",
            "items": {
              "type": "object",
              "required": ["attr", "source_ref"],
              "additionalProperties": false,
              "properties": {
                "attr": {"type": "string"},
                "constructor": {"type": "string"},
                "source_ref": {"oneOf": [{"$ref": "#/definitions/source_ref"}, {"const": "unknown"}]}
              }
            }
          }
        }
      }
    },
    "role_candidates": {
      "type": "object",
      "description": "Proposed semantic roles for declared submodules. Every entry is confidence='low' with the naming hint that produced it, because a name is evidence of intent and not of behaviour. `unresolved` lists attributes no hint matched -- left unassigned on purpose so the mapper sees what still needs deciding instead of inheriting a default.",
      "required": ["roles", "unresolved"],
      "additionalProperties": false,
      "properties": {
        "roles": {
          "type": "array",
          "items": {
            "type": "object",
            "required": ["class_name", "attr", "role", "confidence", "source_ref"],
            "additionalProperties": false,
            "properties": {
              "class_name": {"type": "string"},
              "attr": {"type": "string"},
              "role": {"type": "string"},
              "confidence": {"const": "low"},
              "basis": {"type": "string"},
              "source_ref": {"oneOf": [{"$ref": "#/definitions/source_ref"}, {"const": "unknown"}]}
            }
          }
        },
        "unresolved": {
          "type": "array",
          "items": {
            "type": "object",
            "required": ["class_name", "attr", "source_ref"],
            "additionalProperties": false,
            "properties": {
              "class_name": {"type": "string"},
              "attr": {"type": "string"},
              "source_ref": {"oneOf": [{"$ref": "#/definitions/source_ref"}, {"const": "unknown"}]}
            }
          }
        }
      }
    },
    "known_deviations": {
      "type": "array",
      "description": "Constructs this family is known to defeat static extraction on. Recorded so the gap is visible here rather than surfacing downstream as an unexplained abstention.",
      "items": {
        "type": "object",
        "required": ["id", "reason"],
        "additionalProperties": false,
        "properties": {
          "id": {"type": "string"},
          "reason": {"type": "string"}
        }
      }
    },
    "config_class": {"type": ["string", "null"]},
    "weights_config": {"type": ["string", "null"]},
    "declared_model_path": {"type": ["string", "null"]},
    "source_of_truth": {
      "type": "array",
      "items": {"$ref": "#/definitions/source_ref"}
    },
    "num_main_layers": {"$ref": "#/definitions/int_or_unknown"},
    "layer_groups": {
      "type": "array",
      "items": {"$ref": "#/definitions/layer_group"}
    },
    "prediction_modules": {
      "type": "array",
      "items": {"$ref": "#/definitions/prediction_module"}
    },
    "facts": {
      "type": "array",
      "description": "Every extracted scalar architecture fact with provenance.",
      "items": {"$ref": "#/definitions/fact"}
    },
    "evidence_gaps": {
      "type": "array",
      "items": {"type": "string"},
      "description": "Human-readable list of things that could not be resolved statically."
    },
    "capture_provenance": {"$ref": "#/definitions/capture_provenance"}
  },
  "definitions": {
    "capture_provenance": {
      "type": "object",
      "required": ["tier", "tier_reason", "checkpoint_config"],
      "additionalProperties": false,
      "description": "How much of this capture's architecture claim is bound to evidence, as opposed to read off source that may or may not describe the run. Set by detect_capture_provenance(); consumed by score_breakdown.py to decide which checks are runnable and which denominator the score is out of.",
      "properties": {
        "tier": {
          "enum": ["S0", "S", "A", "B", "C"],
          "description": "S0 = model defined in-repo with random weights, so source is the only truth. S = source snapshot + capture manifest + step marks, so source is bound to this trace. A = source present but not bound to the capture. B = no source. C = neither source nor a usable capture."
        },
        "tier_reason": {"type": "string"},
        "capture_manifest": {"type": ["string", "null"]},
        "source_snapshot": {"type": ["string", "null"]},
        "step_marks": {"type": ["string", "null"]},
        "model_source": {
          "type": "object",
          "additionalProperties": true,
          "properties": {
            "path": {"type": ["string", "null"]},
            "bound_to_capture": {"type": "boolean"}
          }
        },
        "checkpoint_config": {
          "type": "object",
          "required": ["present", "evidence_level", "method"],
          "additionalProperties": true,
          "description": "Where the scalar hyperparameters (num_hidden_layers and friends) come from. Level 4 means an AST default argument nothing confirms, which is why it raises an evidence gap rather than being treated as a fact.",
          "properties": {
            "present": {"type": "boolean"},
            "evidence_level": {
              "enum": [1, 2, "2S", 3, 4],
              "description": "1 = checkpoint config.json, or self-defined source that is itself the truth. 2 = a runtime record (log/summary) that states the value. 2S = an AST default bound to the capture by a source snapshot. 3 = reserved. 4 = an unbound AST default argument."
            },
            "method": {"type": "string"},
            "source_ref": {"type": ["string", "null"]},
            "key": {"type": ["string", "null"]},
            "value": {},
            "excerpt": {"type": ["string", "null"]},
            "note": {"type": ["string", "null"]}
          }
        }
      }
    },
    "int_or_unknown": {
      "oneOf": [
        {"type": "integer", "minimum": 0},
        {"const": "unknown"}
      ]
    },
    "confidence": {"enum": ["high", "medium", "low", "unknown"]},
    "capability": {
      "type": "object",
      "required": ["id", "evidence_keys"],
      "additionalProperties": false,
      "properties": {
        "id": {"type": "string", "description": "e.g. moe / shared_expert / mtp / mla / sparse_index_attention / sliding_window_attention"},
        "evidence_keys": {
          "type": "array",
          "minItems": 1,
          "description": "What evidences this capability: config keys resolved to a truthy value, or the class names that declare it (see source_ref for which channel). Required and non-empty: a capability with no evidence is an assertion, and asserting one turns on validation rules the source never justified. A key present but resolving to None/False/0 is the source saying the feature is off, and does not appear here.",
          "items": {"type": "string"}
        },
        "source_ref": {
          "type": "string",
          "description": "`config:<key>:<line>` when a config value evidences it, `class:<ClassName>` when a module in the modeling source does.",
          "pattern": "^(config:.+:[0-9]+|class:.+)$"
        }
      }
    },
    "extraction_method": {"enum": ["ast_literal", "ast_default_arg", "ast_range_expr", "ast_predicate", "adapter_rule", "config_json", "unknown"]},
    "source_ref": {
      "type": "string",
      "description": "path.py:line or path.py:start-end",
      "pattern": "^.+:[0-9]+(-[0-9]+)?$"
    },
    "fact": {
      "type": "object",
      "required": ["key", "value", "source_ref", "method", "confidence"],
      "additionalProperties": false,
      "properties": {
        "key": {"type": "string"},
        "value": {},
        "source_ref": {"oneOf": [{"$ref": "#/definitions/source_ref"}, {"const": "unknown"}]},
        "method": {"$ref": "#/definitions/extraction_method"},
        "confidence": {"$ref": "#/definitions/confidence"}
      }
    },
    "layer_group": {
      "type": "object",
      "required": ["type", "classification", "source_ref", "confidence"],
      "additionalProperties": false,
      "properties": {
        "type": {"type": "string", "description": "Source class name, optionally suffixed (e.g. DeepseekV3DecoderLayer_dense)"},
        "classification": {"enum": ["dense", "moe", "sliding", "full", "other", "unknown"]},
        "model_layer_indices": {
          "type": "array",
          "items": {"type": "integer", "minimum": 0}
        },
        "model_layer_range": {
          "type": "array",
          "items": {"type": "integer", "minimum": 0},
          "minItems": 2,
          "maxItems": 2,
          "description": "[start, end] inclusive"
        },
        "predicate": {"type": ["string", "null"], "description": "Source predicate that decides membership"},
        "source_ref": {"oneOf": [{"$ref": "#/definitions/source_ref"}, {"const": "unknown"}]},
        "confidence": {"$ref": "#/definitions/confidence"}
      }
    },
    "prediction_module": {
      "type": "object",
      "required": ["type", "learned_module_count", "model_layer_indices", "source_ref", "confidence"],
      "additionalProperties": false,
      "properties": {
        "type": {"type": "string"},
        "learned_module_count": {"$ref": "#/definitions/int_or_unknown"},
        "model_layer_indices": {
          "type": "array",
          "items": {"type": "integer", "minimum": 0}
        },
        "count_config_key": {"type": ["string", "null"], "description": "Config key that governs count, e.g. num_nextn_predict_layers"},
        "source_ref": {"oneOf": [{"$ref": "#/definitions/source_ref"}, {"const": "unknown"}]},
        "confidence": {"$ref": "#/definitions/confidence"}
      }
    }
  }
}
